body,author,negative,neutral,positive,compound
"I disagree with Kap protest on the field. Pro Football is a show, when you wear the uniform of an organisation and you run on the field SHOW ON.   
     
But i'm really uncomfortable with how NFL teams control everything off-field, medias, ""forced volunteering"", can do this, can't do that, etc...   
     
On the field, imo, not the right time. But im convinced teams wouldn't let him do his protest off-field anyway.",Akanan,0.168,0.788,0.044,-0.8438
Bullshit.  Do you even watch football?  He could have started for my Bears last fucking year.  You are a racist.,scrape,0.302,0.698,0.0,-0.8316
Lots of people are just stupid and stubborn,RudelStolz,0.504,0.496,0.0,-0.7269
Remember tat NFL is a private business and have no obligation of Freedom of Speech. If you feel satisfied when youtube or twitter de-platform people you disagree with then this is too a non-issue.,arostrat,0.115,0.718,0.167,0.4939
"Most Cubans who fled the revolution were directly involved in the child slave rape plantations used to groom literal child slaves to be used as sex toys for rich Americans at the mafia owned casinos, but go off on how Castro became ""rich"" by nationalizing most industries and shut down the mafia and literal human rights abuses the US government actively ignored.",st_gulik,0.142,0.741,0.117,-0.431
Those people?  Urban people generate the vast majority of the GDP.  Rural whites are welfare queens.  Fucking unprodictive racists devolving us back to feudalism.,scrape,0.205,0.795,0.0,-0.6887
Sure but if he was good enough it wouldn't have mattered,ndunks1,0.0,0.621,0.379,0.6705
"Plaintiff lawyer here, that's no how that works, in just about every situation where it's an individual suing an entity, the lawyer is paid on a contingency fee which means they get a percentage of whatever is recovered. Can guarantee with it being an employment law issue that Kaepernick's lawyers were working on contingency.",Monster-1776,0.075,0.89,0.035,-0.3182
Lmao triggered. Go be useless somewhere else.,bakein,0.239,0.427,0.333,0.2732
"You're calling it profit but the article lists it as revenue. Those aren't the same thing.

The truth is that a handful of schools may generate some profit in any given year but the vast majority lose money. http://www.ncaa.org/about/resources/media-center/news/athletics-departments-make-more-they-spend-still-minority",05110909,0.075,0.74,0.185,0.6369
My friends and I were actually talking about this last night while playing NHL. None of us ever played hockey but we all played football. We were wondering which hit would be worse. A blindside hit in football or hockey. We assumed hockey due to the speed capable but football has the traction for better footing.,Rfwill13,0.06,0.714,0.226,0.8537
"Not necessarily. NFL team owners didn’t need to collude. Not all nfl teams needed a while, and he might not have fit their scheme anyways

The few teams he would have got msybe the coaches and owners didn’t want the drama that comes with it. Immortal companies stay neutral to not alienate their customers. They will only side with a protest or something once it’s easy to",redtiber,0.057,0.857,0.086,0.2709
"Ok, youve convinced me. Lets go butn down everything because youre mad at society. That should fix all out problems /s.

Meanwhile in reality, you only damage your cause. Perhaps learn how to not be an animal, this is your nee goal for 2020.",bakein,0.176,0.772,0.052,-0.7506
"What part of what i said was racist?! 

I hope this is a joke. You apparently call people racists way too lightly. Calm down. 

I watch a lot of football.. it’s really simple. More talent than drama: you’ve got a job. Less talent than drama? No job.",jbleek,0.155,0.623,0.222,0.4966
You have a choice to eat before or after the game.,tiggertom66,0.0,1.0,0.0,0.0
"You are definitely the type to think ""How did I get here?"" and then blame it on other people with little to no introspection.",Chimmychimm,0.154,0.749,0.096,-0.1585
"If you don’t know anything about football, a QB only getting 4 passing yards after 3/4 of a game is really, really bad. That’s why he was benched.",SitDown_BeHumble,0.131,0.869,0.0,-0.6214
"Really wishing they let him kneel now, aren’t they?",sham3ful2019,0.0,0.785,0.215,0.2944
It proves it wasn’t 100% football three years ago.,ty_kanye_vcool,0.0,1.0,0.0,0.0
"Colin Kaepernick taking a knee at one football game to protest police brutality: He's bad for business, fire his ass.


Michael Vick literally runs a dog fighting ring that kills dogs: Yeah two years is enough, sign him up for another million dollar contract.",RedHairedRedemption,0.359,0.604,0.037,-0.9595
"I mean, more likely they’ll tell you to take it off at wear it on your own time. Which they can legally do because while you’re working there and representing them, you don’t get to do whatever you want without consequences from them. 

But theoretically, yes they could. If you continued to do the same thing time &amp; time again and became such a nuisance or distraction about it, they could fire you. 

Now whether you agree with that or not is not the point. But that’s how the law works.",rbickfor1988,0.065,0.845,0.091,0.1655
if only there was someone for people to not support business that show such a lack morals...perhaps with wallets...,solo220,0.211,0.789,0.0,-0.5511
It's a shame anyone still watches NFL games.,AnxiousSun,0.307,0.693,0.0,-0.4767
"If yours isn’t a rhetorical question, here’s an answer:

The timeline of those two apparent conflicting points you made were not concurrent, but end-joined. Your second point also needs adjusting unless you think *two* teams equals “a bunch”.  

It went like so: After being benched for poor play in favor of an even poorer player, Kaepernick received offers from Baltimore which his girlfriend apparently ruined with a hostile Tweet.  Then the Dolphins showed interest and Kaepernick ruined that himself with a Tweet supporting Fidel Castro which made him public enemy #1 with the Miami fan base.

And *that’s* when bench riding Kaepernick shoveled on the coal with his social justice efforts which evidently made any remaining interested franchises abandon any thought of acquiring a diminished gimmick QB with presently lousy stats and a media circus in tow under the condition he wouldn’t be a starter despite Kaepernick steadfastly refusing a backup position.",Fochinell,0.171,0.67,0.159,-0.5519
"I mean, Donald Trump should never be seen as a function of how the government is supposed to work. And while he made threats, any official actions would have *hopefully* been found unconstitutional. Because they would have been unconstitutional, by the definition of the law.",rbickfor1988,0.058,0.887,0.056,-0.0258
And that's not going to happen.  It's a great example on why we can't rely on the invisible hand of the fucking market to manage things.,GracchiBros,0.0,0.767,0.233,0.8074
Did a single fucking thing change due to your decision?,GracchiBros,0.0,1.0,0.0,0.0
Fair point.,HarleyDavidsonFXR2,0.0,0.303,0.697,0.3182
It was that the small beer was supposed to be 16oz but was actually 20oz. The large was already a 20oz. Hardly a “scandal”.,Yardsale420,0.0,1.0,0.0,0.0
"Kaep was riding the bench and couldn’t make a second read.

Vick did his time and was actually good.",Cal_Lawyer,0.0,0.861,0.139,0.4404
So has pretty much every other business on the planet...,GracchiBros,0.0,0.721,0.279,0.539
Did over 6 years ago now.  Not one fucking thing has changed for the better.,GracchiBros,0.0,0.828,0.172,0.4404
You guys do realize the NFL is private business...if it hurts the business why keep him on?,optovince,0.162,0.838,0.0,-0.4767
"&gt; I just never been comfortable with the protest tactic of refusing to pledge to the flag.

If you care more about a piece of cloth than what people are protesting for you're a lost cause anyway.",GracchiBros,0.268,0.664,0.069,-0.8075
"&gt;Forbes lists LSU's three-year average of football revenue at $112 million, with annual profits of $56 million. If Ed Orgeron puts the proud program on a championship track, those numbers may even increase.

You're ignoring those studies include all sports while there's only some that are viable for making money. You'll notice that the sports outside of the ones that are a business football for example you'll rarely find a lucrative professional  market too.

Schools should be losing money on sports or breaking even at most that's how athletics should be handled and at many schools it is.

The fact that the schools making millions is a minority doesn't somehow excuse the fact that it happens. It's still bad regardless of how many schools are doing it.",Iankill,0.071,0.849,0.08,0.291
"Donald is correct here. No position? Pretty clear this is a statement of empathy and understanding, and a degree of wisdom that might be useful in current circumstance. Looks like a clear position to me that current events are the result of pent up frustration.

But:

Go ahead and try to stop funding these stadiums. Most, btw, are built in Blue cities: San Fran, LA, Seattle, Baltimore, Chicago, Minneapolis, New York, Foxboro,,... list is long.  So while your Democrat masters make tax break deals with the NFL you can continue to vote for them and get rekt.

Good luck with that. But the argument that the NFL has no right to edge Kaepernick out is flawed and hypocritical when it is tied to Free Speech debate. If Twitter can ban users for making political statements that don't jive with their organization's political leanings, so can the NFL. Be consistent.

You're introducing a red herring here with your George Bush nonsense. You've made no argument and your post is just gibbering as far as that goes.",undeadego2,0.146,0.738,0.116,-0.8151
A player-lead strike would be appropriate,unidactyl,0.231,0.769,0.0,-0.128
"What if *it was both*? He wasn’t good enough to overcome the baggage he brought along with him. *Shocker*, I know.",TarHeelTerror,0.068,0.809,0.123,0.3182
Did many years ago.  Used to be a diehard fan.  Didn't change a single thing.  Actually nothing I've ever voted with my wallet for or against hasn't done a fucking thing.  So I'm tired of this bullshit deflection expecting people to just sacrifice the things they love to make some moral point that won't ever fucking do anything.,GracchiBros,0.103,0.8,0.096,-0.1226
the entire 9ers offense and defense changed after that Super Bowl run. you can't put that on him.,alieninthegame,0.089,0.67,0.241,0.5267
"Yeah, he was a sideshow who was putting up worse numbers every year and getting older and older.",NYG_5,0.146,0.751,0.103,-0.2263
he's talented enough to grow and adapt IMO. time will tell.,alieninthegame,0.0,0.752,0.248,0.5106
"No shit.   If you think a distraction like Kaepernick on an NFL team is just easy to forgive you are dreaming.   Millions of dollars are on the line.   All 32 teams are in it to win it, not to divide fans and have the possibility of some outcry or have him be the face of your organization when he's doing a social movement.",sonoranelk,0.078,0.736,0.187,0.8087
"No, I'm not ignoring that. That's why I said athletics loses money, not that football loses money. Football and men's basketball are pretty much the only two sports that have a positive revenue stream. They subsidize all other athletics. The reason you can get a scholarship for gymnastics or volleyball or whatever is because of those two sports.

Personally I don't see anything immoral or unethical when a school makes profit on their athletics in a single year. But regardless, the vast majority of schools lose money on their sports contrary to the popular misconception.",05110909,0.069,0.793,0.139,0.6757
I really hate you and what you stand for.  You and your kind are the reason I can't be happy in this country.  Fuck you all.,GracchiBros,0.292,0.613,0.095,-0.7959
Something something freedom of speech doesn't mean freedom from consequences.,keithps,0.216,0.514,0.27,0.21
I dunno the nfl was still around. People kept watching and people kept going. Seems like a failed effort to me. I mean the headlines were there but that’s about it.,asadoabierto,0.065,0.881,0.053,-0.1027
"The majority of Americans choose not to attend NFL games. It’s just a minority of people that choose to spend their money that way, so it’s only an issue for them (if they even think it’s an issue).",goodDayM,0.0,1.0,0.0,0.0
"I was never talking about the law, i was talking about freedom of speech. They are not the same thing. One is an ideal or a value and the other is an attempt to uphold that value. 

If dominant Social media companies decided to delete every post of a particular political persuasion that would be an obstruction of freedom of speech. I dont care what the law is, the world would functionaly lose freedom of speech and that is something we should fight against. The ability to speak is what is important, not who may or may not be obstructing it.

What happened to Colin demonstrates that athletes in america are not free to speak their minds. Or in other words, they do not have freedom of speech.

Just to remind you, i never cared what the law was, that was never important, and still isnt. What is important is that people can raise their voice against injustice without some rich person shutting them down because it might affect their bottom line and somehow being respected more than someone fighting for social justice",rusthighlander,0.13,0.729,0.141,0.6703
"Fuck the NFL. They’ve made billions off the backs of minorities and the league and its white owners not only wouldn’t take a social stand with their “family”, but turned their back on a good man for having a social conscience and wanting to make this country a better place for everyone. 

So again Fuck the NFL and every entitled white prick who sits and watches it on Sunday without ever thinking of anything else but what goes on between the whistles.",Kattomatte,0.12,0.773,0.107,-0.0689
Tim Tebow was also treated the same. And he was super religious. No body wants a controversial back up QB that makes headlines in the news for not even playing. That’s just unwanted problems.,balancedruidsrockk,0.242,0.665,0.093,-0.5093
So stop telling me this bullshit.  Actions don't speak louder than words.  My actions do not speak.  At least you can read my words here.,GracchiBros,0.233,0.767,0.0,-0.7902
Its not all fun and games. You can only work half the year,missedthecue,0.184,0.816,0.0,-0.4023
"Add Hernandez, the psycho killer, to that list. Do you think his violent temper and behaviors went unnoticed by everyone?",MahatmaBuddah,0.393,0.607,0.0,-0.9001
"&gt;The reason you can get a scholarship for gymnastics or volleyball or whatever is because of those two sports.

I don't believe this football and basketball making money is unique to the US. Volleyball scholarships are available at most universities or colleges with a competitive team. 

Even my local community College offers specifically volleyball scholarships and they aren't subsidized by the football team.

The idea that the revenue generated by football and basketball is necessary for college athletics is a spook in that it controls thinking and behavior despite being not being real

If money wasn't a problem in college sports in the US than why is in many states the highest paid salary that of a college football coach",Iankill,0.0,0.968,0.032,0.4512
You can yell all day long but until Minneapolis ACTS by arresting and charging all 4 cops with murder this chaos won’t end.,asadoabierto,0.375,0.625,0.0,-0.9394
"Yeah, that kneeling thing...",markpas,0.0,0.577,0.423,0.296
I 100% agree. I meant if he continues to play the way he does now. I hope he does because I’m just a fan of the game and man is he fun and exciting.,RIDEMYBONE,0.0,0.628,0.372,0.9393
"I was dying to play HS football. My mother said ""no way Im signing the permission form, your brain is too important."" Played soccer instead, but now, a few decades later, Ive said ""thank you mom, for knowing what I didnt know when I was 13, many times, but especially about this.  (Iwas also a year yoer than anyone in my class bc I moved from a different state in 3rd grade!)",MahatmaBuddah,0.0,0.891,0.109,0.7463
Way to stay focused guys ;-),markpas,0.0,0.465,0.535,0.5574
"I'll never understand how Establishment figures in America like the NFL team owners (ie billionaires), ever thought these protests were going to just go away.

Reinstate Kaep.",Al-Andalusia,0.065,0.85,0.085,0.1531
I'm not an NFL fan because I'm not familiar with last year's 2nd leading tackler on the Carolina Panthers?... that's some high-quality gatekeeping.,PotRoastPotato,0.082,0.918,0.0,-0.2411
"Maybe, maybe not.  Even when this current chaos ends, unless there's some systematic national changes, we'll just be here again in a couple years when another tragedy gets taped in broad daylight.  But that's a completely separate issue from this comment chain where I had an issue with you just telling people to vote with their wallets if they don't' like it.  At least from my POV through my entire life it doesn't make a single bit of a difference.",GracchiBros,0.091,0.909,0.0,-0.7727
When I lived in South Dakota there was an infamous farmer who lived across the border in Nebraska and it seems the small town there had aspirations for glory but he refuse to let his healthy 250 pound sons play high school football. He said he had torn up his knee doing  it and he wasn't going to see any of his kids limping for the rest of their their lives the way he had too. Talk about social pressure. Apparently the consensus was that he was just being a selfish prick.,markpas,0.142,0.776,0.082,-0.7543
"Especially since he pretends to be the poster boy for the struggles of the black community, even though he was adopted into a well-to-do white family and grew up in the fucking suburbs.",Hartagon,0.118,0.882,0.0,-0.4877
"This is why I watch college ball and ONLY college ball.  
This shit is a mockery of *itself*.",6-1Actual,0.29,0.71,0.0,-0.7615
"You can gatekeep how big a fan I am becuse I wasn't familiar with the 2nd leading tackler on the Carolina Panthers, whatever, but if I couldn't remember who he was, when I watch more football than I'm proud of, then I guarantee he's not a household name like Kaepernick. 

And even before he was a household name, a good defensive player is has WAY less fame and recognition than a QB who led a marquee franchise like the 49ers to the Super Bowl.",PotRoastPotato,0.0,0.724,0.276,0.981
"The list would be very long if we tried to include all. The reason I mention Junior Seau, is that the family had initially agreed to donate his brain for research and then something happened that made them change their minds. So, he committed suicide at 42, and no research into the condition of his brain at the time of death.",apocopebooks,0.15,0.791,0.059,-0.8126
You need to generate hundreds of millions of revenue to your team by taking them to the Superbowl.,jrzfeline,0.0,1.0,0.0,0.0
"On one side this makes total sense for me if it was done properly 

When I get soup I’m going to eat in my car I ask them to put the size i want in the next size up container, just so I have some wiggle room at the top to not spill",gmoneygangster3,0.0,0.943,0.057,0.2732
Fuck that. Keep that idiot out,Tvattts,0.63,0.37,0.0,-0.7783
"Side note, Baltimore is the team that deifies the man convicted of interfering in a double murder investigation (Ray Lewis).",PotRoastPotato,0.198,0.802,0.0,-0.6908
"Not even a little, he was a fucking joke",Tvattts,0.0,0.762,0.238,0.3597
Distancing themselves from controversial figures has long been a practice of business organizations. They have the right to do so just as much as he has the right to not be prosecuted for it.,Assaltwaffle,0.05,0.889,0.061,0.0987
Well it's the off-season so,SemperMiG,0.0,0.656,0.344,0.2732
"It doesn't mean you get to, but employers have too much leeway over employee speech imo anyway, and some employers have no problem with their employees expressing political opinions on the job.",Terraneaux,0.0,0.915,0.085,0.438
"He didn't feel right standing for a nation that would allow police brutality and injustice to continue. He wasn't doing it to just be 'controversial'. Like look at me look at me I'm protesting the murder of my black brothers, sorry for inconveniencing you. you're right, he should have worn an armband. How thoughtful.",prevail_,0.287,0.615,0.098,-0.926
"I remember the coach telling us that you had to hurt the opposing player to instil dominance. That, and that most players of the best team he had ever coached were doing their second tour of duty in Vietnam. NOT inspirational in those days. I did get a ""transient"" back injury which showed a compressed disc on X-ray four years later when it started to bother me again but at least we won that game, ooh rah!. It was one year and done to go surfing instead partly because to play basketball, which I think is a great sport, you had to get a short haircut in those days.",markpas,0.061,0.798,0.141,0.9193
"My issue with Kaepernick was not that he was kneeling during the anthem, but that he was doing it at work. We view it all as a game and tend to forget that for them that is their place of work. Being on that field is their job as much as it is yours to sit at a desk or stand at a cash register. If any normal person were to take advantage of their job to push a politicized agenda, they would be fired. Employers do not take kindly to political division in the workplace. He had access to so much more money and time than average people that he could have found any number of platforms to successfully stand on and amplify his voice. Instead, he chose to use his employer’s time and money and then essentially got excommunicated from the NFL.",KylarSternn,0.068,0.879,0.053,-0.5334
"When they did that, every player should have refused to play, but they cared more for their money than anything else.",NukaWax,0.064,0.72,0.216,0.5859
Yeah because being gay means you can dismiss criticism for dictators who persecuted them.,keep_calm_rocket_on,0.283,0.598,0.12,-0.4588
"If we take that Kaepernick is permanently retired, he is an outlier in how skilled he was for an early retirement. The only player that is even near him in Andrew luck, and they play so differently it’s really hard to properly compare them",icygamer6,0.035,0.853,0.112,0.5729
"you are overlooking the fact that no one cared if he was a good player or not, they were upset that he kneeled.  millions of angry white people who didnt give a fuck about football, raging that a black man kneeled durring the anthem.

none of the controversy was over how he played or didnt play football.  stop pretending its relevant.",poopnada,0.173,0.65,0.177,-0.1645
And Tebow was out of the league in 4 years.,3klipse,0.0,1.0,0.0,0.0
"It never came to that tho, because the NFL buckled under the threat and infringed on Kaepernicks rights on behalf of the government.",qwertx0815,0.134,0.866,0.0,-0.5267
"Who said that?  I'm not sure anyone thinks he wasnt good enough for a backup spot, just not for starting money.",3klipse,0.187,0.813,0.0,-0.5216
This could've turned out differently if black fans had boycotted the NFL.,spunjbaf,0.197,0.803,0.0,-0.4019
Wasn't he also being looked at by another team (Baltimore maybe?) before his girlfriend went and said some really racist shit about the owner?,Martial_Nox,0.279,0.721,0.0,-0.8601
"I've got no source,  just multiple idiots on reddit.",MundaneFacts,0.216,0.784,0.0,-0.296
A team that had taken the risk on him would be getting paid in dividends today just in T-shirt sales.,fastdbs,0.1,0.9,0.0,-0.2732
Well they are idiots then.,3klipse,0.0,0.656,0.344,0.2732
"Interesting how I can't find literally a single other source confirming there was a large swathe of people wearing those shirts. Only him.

People constantly shit on Stepehen A for being hyperbolic and having bad takes until they agree with him. Interesting indeed.",Falcon4242,0.134,0.717,0.149,-0.0516
I guess. Kaepernick really wasn't that old in 2017 when all this stuff happened though.,caught_in_a_beartrap,0.0,1.0,0.0,0.0
"Well, “I” am not an angry white man. I’m not over looking anything. This conversation is not political. It’s a conversation about the talent of professional football players. Keeping a starting QB job in the NFL is one of the most difficult things to do. TheCleveland Browns alone have had over 30 starting QBs since 2000. Hardly any of them were black. I’m simply stating that Colin Kaepernick skills were not good enough to land him a starting role in the NFL. “He” made the decision to not come back as a back up because he felt the role was beneath him. So take your political bullshit somewhere else and fuck off.",RIDEMYBONE,0.115,0.825,0.06,-0.7843
"Waitwaitwaitwait holdonaminute...
Just exactly where do you think he should have kneeled in protest other than when a militarist fap session was happening? At home while brushig his teeth?.. at the grocery store checkout?... what is your wise plan here, Master?",Violentusername,0.044,0.866,0.09,0.4696
As are the people who say he would have accepted ANY offer from the NFL,Gaius_Octavius_,0.0,0.87,0.13,0.2732
Nope. Post hoc ergo propter hoc.,358ChaunceyStreet,0.0,1.0,0.0,0.0
Stop using QBR as your end all be all metric lmao,OG_Pow,0.146,0.596,0.258,0.4019
Wore a shirt with Castro and Malcolm X on it I believe.,Martial_Nox,0.0,1.0,0.0,0.0
Patriots were doing the same thing.,VikesonmyNikes,0.0,1.0,0.0,0.0
He was apparently also being seriously considered by the Baltimore Ravens before his girlfriend tweeted at Ray Rice (who was working with the team and pushing them to hire Kaep) a picture from Django Unchained implying that Rice was a House ****** for the owners.,Martial_Nox,0.037,0.963,0.0,-0.1779
