body,author,negative,neutral,positive,compound
"I think him sitting on the bench is exactly why it would be a good decision. You attract the woke crowd just by the decision to have him on the team, and you avoid offending the sizable portion of your fans that hate him too much because they won't have to see him often. The media attention alone would bring quite a lot of value to the team. I'm not saying they'd get thousands of new regular watchers, but the value of their business would go up, opposite of what they thought would happen if Kaepernick joined.",PM-ME-SOMETHING-GOOD,0.072,0.847,0.081,0.2263
"That’s just not true.  The bulk of the money comes from tv contracts which are all split evenly between the teams.  And I doubt they would have struggled to sell out the stadium every Sunday, especially if they’re winning.",SeenC77,0.158,0.763,0.08,-0.3753
"Ah, yes, let's believe Stephen A instead of, you know, trying to figure out Kaep's side...

The organization of that event was a shitshow, the NFL tried to quickly put together an event it was not prepared for to get good PR, and when concerns arose from the contract and waivers, he eventually pulled out. Yeah, I'm sure in the 1 week between being contacted and the workout he just came up with a PR plan instead of having legitimate concerns.",Falcon4242,0.019,0.866,0.115,0.8143
"His very peaceful and respectful protest.

Good thing violence was the only option left",Lying_because_bored,0.246,0.364,0.39,0.5509
He wasn't starting to begin with. He was already a bench warmer.,Virge23,0.0,0.833,0.167,0.296
"He wasn't disrespecting jack shit.

 Kneeling during the pledged of allegiance isn't disrespectful to veterans. 

Conservatives using veterans to undermine a peaceful protest is disrespecting veterans.",Lying_because_bored,0.13,0.681,0.189,0.4449
That’s why I put quotes around disrespecting. He wasn’t actually but that’s what people were saying.,Nerfitti,0.0,1.0,0.0,0.0
The first amendment doesn't mean you get to use your job as a platform for your politics.,Virge23,0.0,1.0,0.0,0.0
"Dude, go to /r/Niners and ask them how good Kaep was that season. The answer they will overwhelmingly give is that he was not good at all. 

The thing about QBs is that stats do not even begin to tell the whole story.",SitDown_BeHumble,0.083,0.855,0.062,-0.0015
"This narrative needs to die.  He had been a benched backup for a while when he merely SAT quietly.  He didn't make a spectacle, he didn't do shit until Right Wingers jumped on him about it.  He then talked to his (white) ex-military fellow player who suggested kneeling was more respectful.  And ... you know what happened next.  Suddenly he's a ""son of a bitch""",Im_The_Daiquiri_Man,0.103,0.814,0.083,-0.3576
Obviously some people want them enough to buy them.,tiggertom66,0.0,0.86,0.14,0.0772
"'ultra woke'

aka regular people who care about police brutality and racism

aka not racist asholes",rubberloves,0.305,0.452,0.242,-0.3979
"He held a ... controversial... opinion. Which could potentially lead to lost revenue. 

Smart business' keep their politics at home (even if you feel you're the righteous one) 

A shitbags money is just as green as a saints money",ErikofTenTowns,0.096,0.841,0.063,-0.1027
"Being blacklisted by teams isn't against any rules.

The lawsuit was claiming that multiple organizations conspired against him in a coordinated effort to keep him out of the league.

You can't sue teams for not wanting to have to deal with the pain in the ass it would be to sign you.",tiggertom66,0.151,0.849,0.0,-0.8271
"Oh I gotcha, very interesting.

&gt;If it really was that hard to prove the NFL might have actually gone through with the lawsuit

What do you mean by this? They wouldn't have defended themselves?",laniganistan,0.103,0.818,0.079,0.1997
How are there still people out there going to bat for Colin Kaepernick? This dude is such a loser and an opportunist.,TDScringe,0.138,0.813,0.049,-0.4939
"Go to XFL games, then. They're more fun, anyways.",Unbecoming_sock,0.0,0.69,0.31,0.5563
"I doubt a comment that vauge would cut it.

It would probably need some sort of call to action, or incentivization to not sign him.",tiggertom66,0.167,0.833,0.0,-0.5574
Don't you dare criticize him. He has more guts and integrity than anyone else I can think of. He is now offering to pay legal bills for protestors so he has most certainly not fucked off. You can though.,peripatetic6,0.03,0.696,0.275,0.8915
captive audience. most games start right at lunchtime and you have to get their an hour before that. perfect for overcharging on food.,yaprettymuch52,0.0,0.856,0.144,0.5719
TBH I'd gladly pay $20 for a hot dog at a baseball game right about now,BenZanotto,0.079,0.787,0.135,0.25
id say it works for both but kaep had worse drama issues but was better than tebow.,yaprettymuch52,0.18,0.652,0.167,-0.0772
"No, he was already riding the pine pony. He started the protesting from the sidelines AFTER he got benched. He wasn’t doing this shit when he was winning games and going to the NFC championship. He did it two years later after his days of being a star were over. He could have stayed on an NFL roster but he wouldn’t have been the star and the center of attention.",Drake0074,0.095,0.851,0.054,-0.4752
But they don't mind controversy from players who are violent domestic abusers and dog fighters. IOW bullshit.,peripatetic6,0.563,0.437,0.0,-0.9568
"The NFL settled, which caused controversy and hurt their standing in some people's eyes. Fueled the opinion that there was fuckery going on. If Kaep had to prove the entire league was in on it, an virtually impossible task, then it would have made the league more likely to not settle, defend themselves in court, and claim the PR high ground (""see, we're legit, and this decision proved it""). Instead the requirement was lower, saw the PR risk if they lost, settled, and stayed quiet while being able to still deny the allegations.",Falcon4242,0.124,0.876,0.0,-0.886
That was a bullshit NFL PR stunt and you are a bullshit NFL mouthpiece.,peripatetic6,0.388,0.612,0.0,-0.8225
"So people want food, and the venues provide it at a rate people are willing to pay?",tiggertom66,0.078,0.834,0.088,0.046
"The original reason for the anthem protests was because of police violence. Athletes were staying seated during the anthem. An NFL played and Ex green barrette came out and was talking about how staying seated for the anthem was actually a bit disrespectful, that they should take a knee instead. 

And so the players took a knee (then raised fists later on) but it still got spun around and people said it was disrespecting the flag and the troops, it was never about that.",Bman092,0.046,0.916,0.038,-0.1655
"i want the XFL to get big, i was really enjoying this last (and only) season",Sullen_Sigh,0.0,0.737,0.263,0.6115
Yes. And beating up women is fine for players too. But no kneeling!,peripatetic6,0.294,0.519,0.187,-0.4295
You’re what’s wrong with the country right now. You care more about money than what is morally just.,Metal-Butterfly,0.139,0.717,0.143,0.0258
You nailed it.,peripatetic6,0.0,1.0,0.0,0.0
You wouldnt have to worry about brain damage so that's an advantage.,peripatetic6,0.19,0.534,0.277,0.1204
"If you have something worth fighting for and you have a stage to fight for it on, then you fight for it.",Metal-Butterfly,0.279,0.652,0.069,-0.7003
And you accept the consequences.,Virge23,0.0,0.606,0.394,0.3818
Yeah he probably would have been bad for business. Mainly because he was no longer a good quarterback.,Brinsmead,0.23,0.565,0.206,-0.1531
XFL is gone.,TheLoveOfPI,0.0,1.0,0.0,0.0
"There is no life without money. It is their livelihood. How many people would take a 20% paycut to support a cause? It does not matter how much you make, I don't know of many people who would do it, whether rich or poor.",codwapeace,0.121,0.724,0.154,0.4071
The NFL is what the XFL would be if it got big.,jsamuraij,0.0,1.0,0.0,0.0
"No, it doesn't. Ray Rice's career stopped when his video came out. Every incident of domestic abuse is investigated by the league. Very large suspensions happen all of the time. The players are also drug tested, so it's stupid to assume that many of them do drugs.",TheLoveOfPI,0.182,0.818,0.0,-0.8683
"Except the vast majority of people are perfectly capable of understanding and supporting Kaps protest without thinking that they have to become fans of his new team in order to do so.  The ultra woke, aka not regular people, are the ones I suspect would have trouble making this distinction.",SeenC77,0.114,0.726,0.16,0.5859
"So many teams have white QB, white coach, and black every other position offence and defence. As an observer from another country, it’s so obvious. 

They guys doing the work are not the guys getting the credit.",geekpeeps,0.055,0.846,0.1,0.2023
Nothing to do with business. NO team wants to hire a backup quarterback who is a massive distraction.,TheLoveOfPI,0.257,0.743,0.0,-0.6739
He was free to denounce murder all he wants  with his vast amounts of free time. He also chose to leave his last contract.,TheLoveOfPI,0.245,0.56,0.195,-0.1779
Nothing to do with it. Kaepernick is a backup. Nobody wants a distraction as a backup. Ever since this happened he's made a mockery of every opportunity that he was given.,TheLoveOfPI,0.137,0.784,0.078,-0.2732
Don't come to Reddit and spout facts that counter the narrative.,Brinsmead,0.0,1.0,0.0,0.0
The number of fans would be a wash. No team wants to have the main focus of their football team being their backup quarterback.,TheLoveOfPI,0.086,0.863,0.051,-0.2263
"He wasn't black listed. Seattle was interested in him. He showed up, they asked him what his plan would be to handle the media spotlight that would follow his signing. He had no answer. What he did atet workout that the NFL setup for him was an embarrassment.",TheLoveOfPI,0.097,0.852,0.051,-0.34
Are you being for real when you say a $20 hotdog or is that a bit of an exaggeration?,PicsOnlyMe,0.0,1.0,0.0,0.0
"The Seahawks, who'll sign anyone, talked to him. Their main question was how are you going to handle the media spotlight. They got a response of crickets. Moved on. Getting 53 people to move in one direction is hard when one of them is going to just be a constant distraction.",TheLoveOfPI,0.075,0.925,0.0,-0.4588
"Hey, let me take this time you have set aside to unite the country and honor our dead by hijacking it with my own cause!

Very respectful indeed. Violence goes both ways, protestors getting tossed out of the residential areas because they don’t want you to make their lives as shitty as yours.",bakein,0.186,0.698,0.116,-0.7759
"How do I get in on this $480,000  a year minimum salary slavery deal?",TheLoveOfPI,0.27,0.73,0.0,-0.7003
$20 could probably get you two or three depending on the stadium.,thecoffee,0.0,1.0,0.0,0.0
He's like Jussie running around the police station with a rope around his neck from the imaginary lynching.,TheLoveOfPI,0.0,0.872,0.128,0.3612
Burn down the city?,DicknWalkn,0.0,1.0,0.0,0.0
Is this surprising news to ppl?,deadlands_goon,0.0,0.704,0.296,0.2732
"Actually, they really do. The whole thing cost that dog killing piece of shit most of his career and $20M.

He how works for Fox Sports. I'd suggest harassing them and calling them out on social media if you care about this topic.",TheLoveOfPI,0.214,0.726,0.06,-0.8519
"NFL, we likes black athletes to just shut the hell up and act like bulls and ram into each other for our entertainment, that is what we pay you guys for.",freebluespike,0.15,0.648,0.202,0.2732
joe burrow is legit already in my eyes. my favorite player EVER peyton manning would never speak against anything that hurts his image and bottom line. in fact he worked with a very public racist papa john. life is a complicated thing.,THE_REAL_MR_BULLDOPS,0.149,0.79,0.061,-0.6573
It was about football. Nobody wants a giant distraction as a backup quarterback.,TheLoveOfPI,0.178,0.822,0.0,-0.3818
Woulda been a sweet distraction from the losing for the Redskins,Pill_Cosby,0.321,0.494,0.185,-0.296
All of those players could have peacefully protested after work.,TheLoveOfPI,0.116,0.62,0.264,0.4404
Half the time the hot dogs aren’t even that good either smh,babztheslag,0.151,0.658,0.191,0.1531
Chickens coming hole to roost,jimthetrimm,0.0,1.0,0.0,0.0
"You don't get to protest at work. That's not what people fought and died for. Also, you're free to go call a nice grandmother walking down the street a ****. You're a piece of garbage for doing it, but you can. 

What you're putting forward is not really a valid analysis of the situation. Also, for plenty of people who didn't want the protests, they just want football to be apolitical from any political viewpoint.",TheLoveOfPI,0.045,0.827,0.128,0.5743
There's lots of outspoken players in the league and plenty who don't throw a ball.,TheLoveOfPI,0.0,1.0,0.0,0.0
"&gt;Hey, let me take this time you have set aside to unite the country and honor our dead by hijacking it with my own cause

Yeah, who cares about innocent people getting killed by police? People's feelings being hurt is more important.",ray1290,0.206,0.575,0.218,-0.3197
"Kaepernick was about to be signed by the Ravens until his gf compared the owners to slavers. I'm thinking a job iwht a $480,000 minimum salary is probably not what slaves in this country went through.",TheLoveOfPI,0.0,1.0,0.0,0.0
"Regular season MVP Lamer Jackson, Super Bowl MVP Patrick Mahomes.",Gaitingdoochain,0.168,0.559,0.273,0.3612
"Think of sports stadia as ""Wealth Transfer Points"", where the lower classes come to transfer hundreds of thousands even millions of dollars, Euros, punts, yen, pesos, or Wang Chungs into the accounts of the billionaire class.

Makes a different kind of sense, dunnit?",Shagata_Ganai,0.047,0.884,0.069,0.25
"Yeah, but there was a series of events there. 

Kaepernick: takes a knee.

Trump: disrespectful! He should be fired! If fans boycott the games, they’ll fire him!

Trump followers: well, now I’m boycotting!

NFL: guess we better fire Kaepernick.

Let’s not pretend this happened in a vacuum. I saw this exact situation play out with my father, who suddenly couldn’t watch NFL because his president told him not to.",prismabird,0.208,0.653,0.14,-0.8452
"Never argued against that. But looting your local businesses and homes hurt the police how? Oh wait, it doesn’t. 

Look at Baltimore post eric garner riots (&lt;10 yrs ago).Those areas are worse off than before, and this is what you consign law abiding citizens to when you want to wreck you community. Then your going to start whining why your community is destitute and you’ll only have yourself to blame. Worst part is, you will then leave and only screw over what community you would move to because you don’t think destroying your community is wrong.

Your tantrums only hurt your neighbor’s , work on meaningful change, cause Target doesn’t make laws. Better to be useless than be malignant.",bakein,0.318,0.622,0.06,-0.9927
I was only talking about Kaepernick's protest...,ray1290,0.25,0.75,0.0,-0.25
I am not so sure that the *Redskins* are the best team to promote symbolic protests against racism in America.,bpastore,0.28,0.495,0.225,-0.1713
"When no one was paying attention? 

The inconvenience of football players protesting during the anthem before football games is really enough of an inconvenience to cause you to turn a blind eye to the fact we live in a police state?

What is the “correct” way of protesting in your eyes, that would still actually send any sort of message?",TheBigBaby,0.229,0.771,0.0,-0.933
Respectful was not anyway to describe his protest. Equating cops to pigs and hijacking other peoples causes is selfish and actually disrespectful. Kinda like how Kanye stole Taylor Swifts spot light.,bakein,0.137,0.724,0.14,0.0276
"Protests aren't supposed respectful. The entire point is to get attention, and being respectful isn't a good way to get it.",ray1290,0.253,0.635,0.112,-0.4188
"&gt; Kaepernick's final season he was rated 90.7, which was above his career average so the idea his play had declined significantly isn't supported by facts.

His QBR was awful in each of his last two seasons in the league.  He was 30th in 2015 and 22nd in 2016, versus 4th in a half season in 2012 and 8th in 2013.  He basically went from a Pro Bowl-level QB to one of the worst starters in the league.",internet_poster,0.106,0.866,0.028,-0.7692
"&gt; Tim Tebow never did anything wrong, and no team would ever sign him 

Tebow would totally have gotten signed if he wasn’t utterly terrible at throwing a football further than a few yards down the field.",internet_poster,0.133,0.807,0.061,-0.4659
He went from starter to riding the bench and that's when he decided to sit during the national anthem. He looked like he was pouting because he was pulled from the lineup. He didnt mention any protest until the media -not right wingers- asked why he didnt stand with the rest of his team.,JuleeeNAJ,0.0,0.925,0.075,0.5007
$20 hotdogs?,Crispycritter23,0.0,1.0,0.0,0.0
"Lol your first post mentioned it was a very respectful protest, now your saying protests ( including his by proxy) are not respectful. Nice contradiction Einstein.

Thing is, there are respectful ways to protest, and there are non respectful ways. You choose the latter since you enjoy the rush from being a prick. Meanwhile the rest of us look at you and other children derailing progress cause you want to flex.

Quit excusing shitty behavior to feed your emotional side, you know how to act-just do it ™️",bakein,0.151,0.648,0.202,0.6949
"So season ticket holders threatening to cancel doesn't have anything to do with business?

Or people who stop watching games?",aaden08,0.319,0.681,0.0,-0.7882
"""Hi, I'm mediocre at football, but I'm the first horseman of The Apocalypse and we need to start the race war!""",CherokeeSurprise,0.22,0.78,0.0,-0.7678
thats only true if the team is owned by a small group of people/single person. a lot of teams in europe are supported by a club which is owned in large part by its members and not really run as a for profit business. that wouldnt really work in america though because its assumed that running everything like a business is the best way to do it no matter what :/,yallshouldve,0.042,0.779,0.179,0.9047
Dude..context.,CheapLegalRamen,0.0,1.0,0.0,0.0
"Don't put dick in crazy, sorry Richard",thecichos,0.356,0.385,0.26,0.0005
"Ok.

Go to Europe, then.

Did I sound like I was asking for exceptions?

I didn't mean to.",Shagata_Ganai,0.0,0.872,0.128,0.3612
"No, it's just been cancelled for the season. It's coming back after this pandemic is over. They have funding secured for five years of operation. They're still paying their employees, so they definitely aren't ""gone"".",Unbecoming_sock,0.05,0.806,0.143,0.5688
"This isn't true, Seahawks management straight up asked him if he was going to continue his protests during the national anthem as a requirement for signing.",CheapLegalRamen,0.145,0.79,0.065,-0.3252
"It's more about having an employee use your business/platform for their own personal use.. Not saying that it wasn't a good message, but you'll find most businesses do not allow their staff to use company property (NFL Stadiums/NFL Broadcasts) for personal needs.",JobbieJob,0.085,0.915,0.0,-0.4023
I mean if we are being technical yes that is what they are paid for,wassameme,0.0,0.838,0.162,0.4019
Lol...such a intellectual movement Amirite?!,JobbieJob,0.0,0.527,0.473,0.5562
Nobody WANTS protest of any kind. The real problem is nobody seems to listen to peaceful protest anymore,walshk8,0.255,0.494,0.251,0.2263
"Well, yeah.   Fox News, and by extension, president trump, were insisting this was unpatriotic.",MrRuby,0.0,0.736,0.264,0.5106
you said it as if thats a universal truth all over the world. and i actually think the idea of wealth transfer point is a cool idea. im just trying to point out that it doesnt have to be that way,yallshouldve,0.0,0.83,0.17,0.7783
"""Personal needs""",CaptainLookylou,0.0,1.0,0.0,0.0
"Maybe you should watch more closely. At least 9 starting QBs are black, and those are just the ones I can name off the top of my head.",kevinmorice,0.0,0.938,0.062,0.2023
"Hard to side with Kaepernick here.  Can't think of any employer who allows their employee to during work hours and using work premises use it for pushing political views.  Most work places try to stay away from these things and be neutral and just focus on the business at hand.

I would side with Kaep more if he did his stuff outside of work.  He is already a celebrity and played in the Superbowl so he already has a platform he can use.  Doesn't have to be a work platform.",MatthewNagy,0.015,0.926,0.06,0.6369
"Hey, remember when Republicans threw a fucking hissy fit when black people tried protesting police brutality peacefully through kneeling?",Yerambe,0.243,0.536,0.221,-0.1585
People also over look the fact that his stats straight sucked balls for like 2 years prior to all of this happening. Money and winning are what really drives NFL teams. Kap wasn’t going to help you win and was going to cost you a lot of money.,RIDEMYBONE,0.051,0.708,0.241,0.8834
Because he created drama during work hours and at work place events.  Kaepernick was already famous could easily use his celebrity status to advocate his social/political issues outside of work.  Most employers don't want people to be political within the work place and try to keep it neutral.  The NFL at the end of the day is a business.,MatthewNagy,0.024,0.905,0.071,0.4431
The only problem I had with Kap was I watch the NFL to get away from politics and just want to watch football.,thatsortofguy,0.108,0.84,0.052,-0.34
"I guess police brutality isn’t so bad when far left dictators use it to oppress catholics, gays, political dissenters, landowners, anyone without a hammer and swastika tattooed on their ass.",keep_calm_rocket_on,0.295,0.705,0.0,-0.9061
The word duh comes to mind here,pennywise1235,0.0,1.0,0.0,0.0
NFL is full of crap!! It’s not bad for business for them to continue to employ those players who beat and abuse their wives!? They even resigned Michael Vick after he pled guilty to dog fighting!!,Soleil-3,0.317,0.623,0.059,-0.9085
european soccer leagues are not the best example; the best teams just buy championships every year using foreign billionaire owners,ogfk,0.121,0.612,0.266,0.6164
Oh my gosh this is such news I had no idea?!,rug1998,0.199,0.801,0.0,-0.3595
Words right! They're fun ;),JobbieJob,0.0,0.353,0.647,0.6696
I disagree that protesting systemic police violence is a personal need. It diminishes what he was doing to seem selfish where in fact he lost his career for trying to bring attention to something.,CaptainLookylou,0.339,0.661,0.0,-0.9313
"Today in ""obvious news you didn't need to be told.""",intelligentquote0,0.0,1.0,0.0,0.0
No form of protest is every right to you guys.... That's why we are here. You don't get to gatekeep.,aloneinorbit-,0.189,0.811,0.0,-0.4939
"He’d be great for a team. He’s a leader. He’s articulate, composed and doesn’t shy away from adversity. He’s also a badass quarterback.",joemammamn,0.158,0.627,0.215,0.4019
"Lmao you should really check usernames before calling out contradictions.

&gt;Thing is, there are respectful ways to protest

Those ways usually don't work. If it's respectful, then people probably won't give a shit.",ray1290,0.097,0.612,0.291,0.8599
"The ironic thing is it was pointed out that the settling still netted them a negative cash flow after all the lawyer fees.

Basically the NFL ""won"" the lawsuit because they weren't burning more cash on billable hours, while Kaepernick got to walk away with a media spin that the NFL settled.",Tarmacked,0.121,0.816,0.063,-0.34
"&gt;  they won't be too offended because they don't have to see him often

Well, except for every time the national anthem plays.",LeoRidesHisBike,0.0,0.774,0.226,0.5913
if you lose your job and don't whine about it.,Chinesepens,0.211,0.625,0.165,-0.1506
"Why the fuck did they need to play the national anthem anyway? Its not as though people go to game to hear the NA. The whole thing could have been squashed, we know who we are. I wasn’t aware listening to the NA before a game  was so euphoric for that many people.",smarthands310,0.057,0.816,0.127,0.6447
"You ever see the seahawks beer scandal? Their large and regular held the exact same volume, the large was skinnier, yet taller.",powerlesshero111,0.121,0.879,0.0,-0.4404
Yea. My friend walks with a permanent small limp from HS football that's never going away. Talk about not worth it.,Captcha_Imagination,0.07,0.796,0.134,0.3682
"Fuck the NFL. They should have been honored to have players that can think for themselves and be a voice for the voiceless.

The NBA is where player respect is really at",MaskedMadness94,0.089,0.736,0.175,0.5267
The media attention and attention from the woke crowd would have lasted about 1 week.  No one is tuning in just to see someone play occasionally.,tr851,0.077,0.839,0.084,0.0516
"What are you talking about?  i didn't say any form of protest is wrong.  Try working at any place and protest while at work, no one will allow to.  Go work at Chiptole and hand out BLM or MAGA shirts at the check out counter and tell me you won't get fired.

The inability to think reasonably is why there's an issue in the first place.  Kaep is already famous.  He can launch any compaign he wants using his celebrity status.  He can get supporters. Yet he chose to run his campaign at work.",MatthewNagy,0.111,0.788,0.101,-0.0196
