author,body,created
[deleted],[removed],2020-05-31 03:59:58
[deleted],[removed],2020-05-31 04:00:39
[deleted],[deleted],2020-05-31 04:00:49
aloneinorbit-,"So you mean all the idiots trying to convince us it was about football were full of shit?

Color me shocked. Well way to go, guys. Ignoring peaceful protests and even ridiculing it like Kaepernick got us here",2020-05-31 04:01:26
PotRoastPotato,"&gt;Joe Lockhart, the former NFL vice president of communications from 2016-18, discussed how Kaepernick's silent protests shook team owners and started a social justice conversation around the league. However, **Lockhart also admitted what no one at the NFL has ever explicitly stated about the situation**:

&gt;""No teams wanted to sign a player—even one as talented as Kaepernick—whom they saw as controversial, and, therefore, bad for business.""",2020-05-31 04:03:44
[deleted],[removed],2020-05-31 04:04:03
[deleted],[deleted],2020-05-31 04:06:27
Strom41,Dude was benched before all his diva drama.  Figure it out.,2020-05-31 04:09:14
[deleted],[removed],2020-05-31 04:10:26
Gaitingdoochain,"NFL teams don't want controversy out of their back up QBs. Kap was without a doubt good enough to have still been in the league, but he wasn't good enough that teams couldn't pass on him.",2020-05-31 04:11:16
ndunks1,The truth is he wasn't good enough to outweigh the drama. It's as simple as that,2020-05-31 04:12:31
MaekerBaefield,"Eric Reid was a big part of the protest and he consistently had a job and was signed before Tre Boston and Kenny Vacarro were. The more I think about that and Kaep being benched for Blaine Gabbert, the more I think Kaep wasn’t really a starting QB in the league. People throw out his 16 TD 4 INT year but totally ignore that he got benched for a laughing stock QB and was unable to win another job. The NFL also employs women beaters, kid beaters, murderers, rapists. 

Idk, as much as one would like to say he was black balled I’m not so sure anymore.",2020-05-31 04:13:07
Fochinell,"&gt; Kap was without a doubt good enough to have still been in the league

Doing what exactly?",2020-05-31 04:13:52
thebasisofabassist,No shit. That and he wasn't that good.  Even Antonio Brown played a couple games last year on skill alone,2020-05-31 04:16:55
ttystikk,"Well, blackballing him was also bad for business; I haven't watched an NFL game since. No swag, no eyeballs, no ratings, no shirt, nothing.",2020-05-31 04:18:55
PotRoastPotato,"Man, you have a quote from an a recent NFL VP saying it wasn't because of his talent but the controversy he brought, yet you still doubt. 

I'm a huge NFL fan and I'm racking my brain trying to think who Eric Reid is and who he plays/played for.

Meanwhile every man, woman in child in America knows Kaepernick and has an opinion on him. Not the case for Reid. 

The idea that Kaepernick wasn't good enough to be a backup or even third string QB somewhere by talent is pretty damn preposterous. Anyone who makes that argument basically is revealing that they don't know what they're talking  about when it comes to football.

Don't take my word for it, you now have the word from the horse's mouth, a former NFL executive.",2020-05-31 04:24:41
vanitas-element,"You wouldnt prefer police demilitarization in response to his ""diva drama"" to the current situation?

Those who make peaceful revolution impossible make violent revolution inevitable.",2020-05-31 04:25:08
Smurf-Sauce,"I wish I could find it but there’s a video on YouTube addressing the claim that Kaep wasn’t starting material, comparing his performance to other starting QBs. The conclusion was that his numbers were better than most starters, so it couldn’t have been his on the field performance that kept him out of the league.

Edit : I think this was it https://m.youtube.com/watch?v=1I0cUTXwr-k",2020-05-31 04:26:01
Casperboy68,"He didn’t care if it was bad for business. It was more important than that. He stood for something, and he knelt for something, and the fact that knuckle draggers tried to make it out to be “unpatriotic” doesn’t matter. Because logical people understand that the people who stand against him are opposed to minorities, regardless of the means the use to express their oppression. They will never accept any aversion to their oppression whether it be peaceful or otherwise. Those that oppose him want minorities to shut up and know their place, similar to the 1950’s. They want to be called “Sir” and not looked in the eye. But FUCK them. This is not their country anymore. It’s ours. And we can say that equal is equal, and right is right. You can’t own people anymore. Ever.",2020-05-31 04:31:29
mattyboy323,He also wanted starter money when teams looked at him as a backup. And no media circus is worth it for a backup.,2020-05-31 04:33:07
appstategrier,"No shit.

He was bad for business and not good enough to outweigh that liability. Hence he’s unemployed. That’s kinda just how employment works. If you aren’t a valuable asset then you don’t get hired, or you get let go.",2020-05-31 04:34:17
OstrakaSocratis,"He wasn’t that great of a player to be anything other than a third string practice squad type of player. NFL teams keep around murders, dog killers, rapists , shit stirrers, whoever as long they’re good enough to contribute significantly toward winning to make headache of keeping on the team worth it. The juice was never worth the squeeze for him and his controversy quite frankly was almost completely irrelevant to him not being picked up by any team because best case scenario he would only be picked up by a team super desperate for a practice squad guy. Look at his Stats for the last season he had, he had the worst sack percentage of any quarterback in NFL history besides one other quarterback. He was a decent average NFL quarterback but, he was trending to be a backup in final season.",2020-05-31 04:34:42
merlinsbeers,There were at least three teams where he would have been a no-brainer as starter.,2020-05-31 04:34:43
merlinsbeers,Starting QB on a number of shitty teams.,2020-05-31 04:35:30
mattyboy323,Victory formation,2020-05-31 04:35:37
Gmen9256,"First off, Kaep wanted starter money for being a backup.

Secondly, he was literally about to get an offer from Baltimore when him and his gf decided to completely derail the opportunity.",2020-05-31 04:36:16
merlinsbeers,"The league isn't good enough to outweigh the drama. If they can't survive without pandering to the racist fans, then fuck 'em.",2020-05-31 04:37:03
Fochinell,"&gt; The idea that Kaepernick wasn't good enough to be a backup or even third string QB somewhere by talent is pretty damn preposterous.

Kaepernick’s final season stats (a 2-14 season) placed him in the last third string position of 32 teams in the season the NFL consented to give him a public workout in his lawsuit settlement.  They’ve talked the subject to death with supporting stats on /r/NFL.

Kaepernick apparently wasn’t going to accept anything but a starting QB position at his tremendous salary rate while showing performance about equal to the Cleveland Brown’s third string QB backup.

The man had four solid seasons and went to crap.  It happens to NFL Quarterbacks.",2020-05-31 04:37:58
merlinsbeers,*injured and then disused by his team. Other teams would have been glad to have him.,2020-05-31 04:38:02
[deleted],[deleted],2020-05-31 04:39:18
badkittenatl,"As a female who might watch 2 football games a year and knows next to nothing about it beyond the gist of the rules, I thought this was obvious?",2020-05-31 04:39:27
TheWyldMan,Yes but his girlfriend messed up his relationship with Baltimore and he had made pro Castro comments in Miami,2020-05-31 04:39:31
Gaitingdoochain,Kap was good enough make 6 maybe 7 figures to hold a clipboard and wear a visor.,2020-05-31 04:41:02
Fochinell,"He was indeed given an offer for a team matching that description and turned it down flat.

Plus, the Bears already had Jay Cutler.",2020-05-31 04:41:20
PotRoastPotato,"A recent NFL VP literally said the reason he was signed was becuse of controversy... Not talent, not performance. 

This is a league that happily employs serial rapists and wife-beaters and deifies a man convicted of obstruction of justice in a double murder investigation. And you think his girlfriend making a stupid tweet is why he's out of the league?",2020-05-31 04:43:26
[deleted],[removed],2020-05-31 04:44:58
91jumpstreet,Lets talk about that drama . Why does it bother people so much?,2020-05-31 04:45:22
Fochinell,"I think he might have made a good TE, but he insisted on playing as a QB.",2020-05-31 04:45:54
Mist_Rising,"NFL,ratings increased in 2019, and dominated the TV time it used. Not sure your personal experience quite hurt them sorry to say.",2020-05-31 04:46:38
PotRoastPotato,"A recent NFL VP is on the record stating that the reason he is out of the league is because of controversy. Not talent, not performance, not salary demands, not roster demands... But because he's controversial.

In fact, this quote from an NFL VP is what this entire story is about.",2020-05-31 04:46:40
Durflol,"Pointing out that the niners went 2-14 is disingenuous. Ownership scrapped the absolute shit out of that team and throwing out Harbaugh for Tomsula was a very clear sign to everyone that Niners management was hopeless. I genuinely cannot imagine who would have done well that last season, let alone led them to a winning record.",2020-05-31 04:50:20
Mist_Rising,"It's more complicated then this comment seems to make it. If he'd been seen as better then Tom Brady (a walking talking scandal man), he'd have likely been fine. It was his controversy combined with his skill, or lack there of, that got him into this mess.

Like all employment, its a risk reward situation. So it was both this and his ability. But everyone wants to reduce everything to simple terms, myself included.",2020-05-31 04:51:20
MaekerBaefield,"You’re either lying about being a huge NFL fan or not knowing Eric Reid. You’re lying about one of them. He was basically the second biggest in the protests and has been a starter in the league since he entered the NFL 

And I said I don’t think he was a starting QB. He would have been one of the better backups in the league no doubt. Easily top 5 backup. Teams deal with media personalities for starters. Teams don’t do the same for backups. That’s not unique to this situation. That doesn’t means he was intentionally blackballed. Means he didn’t fit in anywhere",2020-05-31 04:51:57
[deleted],[deleted],2020-05-31 04:52:46
MaekerBaefield,He had a few good years as a starter no doubt. But he got benched for one of the worst QBs in years and never got the job back. He fell off a Cliff talent wise. Still could’ve been a backup but the NFL takes the media hit for starters not backups.,2020-05-31 04:54:50
[deleted],[removed],2020-05-31 04:55:12
Trappedintheshower,"The NFL and the teams are just a business when it’s boiled down. Dumb people don’t own sports teams, and if they do they have smart people helping them run it. 

Even if the owner is in support of the cause he was trying to promote, they know their fan base most likely isn’t. Look at the general demographic of what you would call stereotypical diehard NFL fans. It’s obvious they mostly likely don’t support what Kaep was promoting. 

Business is about making money, and when you’re talking about millions upon millions of dollars of possibly lost revenue generally the greed of the rich team owners will outweigh their support of Kaep’s cause. 

Would an NBA time sign a player who made comments supporting the cop that killed George Floyd? No chance. 

And let me make the distinction that I know Kaep’s protest and supporting a cop that murdered someone are not the same, but that the thought process of the owners would be the same.",2020-05-31 04:58:10
happyscrappy,"Yeah. No kidding. Some owners said about as much. One team, the Browns or someone said that they were contacted by representatives from groups of season ticket holders who said they would stop buying tickets if he were signed.

People made out like it had to be a conspiracy, some kind of blackballing. But that's just not the case. Every team can individually realize that hiring him could hurt them financially and act on their own. And there isn't a lot of reason to think they didn't act on this basis.",2020-05-31 04:58:14
kungfoojesus,"I support caps stance but this take is the most accurate. He was good, no doubt. Better than many, at worst a solid backup but not nearly elite or good enough to justify a perceived business side drawback.

It always seemed like a business decision to me. One that bowed to racist undertones for sure. The owners love their money. They may care about a cause but not nearly enough to cost them millions.",2020-05-31 04:58:48
ttystikk,Not my concern.,2020-05-31 04:59:43
[deleted],[removed],2020-05-31 04:59:45
Jeddiewan,"You know what's bad for business? Riots; when peaceful protest doesn't do anything but cost a guy his job, because acknowledging systemic racism is unpatriotic.",2020-05-31 05:01:10
[deleted],[removed],2020-05-31 05:05:54
[deleted],[removed],2020-05-31 05:06:42
Fochinell,"Yes, I read it.  This former NFL VP of Communications is Joe Lockhart, former press secretary for President Clinton who was in the NFL’s front office for barely two seasons before he decided to “spend more time with his family” if you understand what that means.  Before that, he was at Facebook for a year heading their corporate policy team until he went unemployed for four years.

Probably before your time, but you might want to learn a little something about Joe Lockhart and his politically appointed favoritism no-show jobs in his post-Clinton era  (:Makes tipping bottle pantomime while issuing ‘glug glug glug’ sounds:)",2020-05-31 05:07:19
Variationofmatt,"That how I see it, I really think it was 32 individual owners independently saying this guy is bad for our brand. I don’t believe there was a collective effort to blackball him. Some people think he got an offer in 2017 from the Ravens but it was rescinded when his girlfriend tweeted some dumb shit about Ray Lewis being an Uncle Tom.
https://www.nbcsports.com/washington/baltimore-ravens/ray-lewis-claims-ravens-didnt-sign-colin-kaepernick-after-girlfriends-tweet",2020-05-31 05:07:40
smoke_and_spark,"He’d of likely been fine here in San Francisco, though I don’t think he was a great QB at the time. Politically speaking though, he was fine here.",2020-05-31 05:09:27
jvpewster,Anyone who watched CJ Beatherd play in 2017 could have told you that guy who played in the Super Bowl 3 years before was better.,2020-05-31 05:10:12
-bbbbbbbbbb-,"The guy literally lost out to Blaine Gabbert in SF. People are delusional. He had 1 season of good play (surrounded by one of the best teams in football) and outside of that was terrible. He got worse in all aspects of the game every season after his good one.

People want this to be a race issue so desperately, but its just not. The NFL will sign anyone no matter how ""bad for business"" they might be if they can play. We're talking about the league that has dozens of domestic abusers on rosters. A league that signed Mike Vick after he literally went to prison for his brutal dog fighting operation. A league that had multiple teams sign Donte Stallworth after he literally killed someone driving drunk.

Half the country hates Trump and many of them are the younger audience that the NFL wants to reach. If Kaep could play or was willing to play for what he's worth he'd have been signed.",2020-05-31 05:10:40
JessumB,"&gt;saying it wasn't because of his talent

Of course it was because of the talent ultimately.   He was seen as too much of a potential distraction compared to what he offered as a player.  

  If he was as good as Russell Wilson or Aaron Rodgers, teams would let him kneel on the 50 yard line to start and finish each half while being escorted by the Black Panthers and would give zero fucks as to what anyone thought.  True franchise QB's are absolutely priceless.   


How much teams are willing to put up with depends almost entirely on just how good you are.   You can be a huge asshole but as long as you are really good, you have a job.   You can be extremely controversial, but as long as you are really good, you have a job.   You can be considered a distraction but as long as you are really good, you have a job.",2020-05-31 05:11:07
Arcade80sbillsfan,"Come on...are you telling me he's worse than Nathan Peterman.  

https://youtu.be/i5X3fYIbGQA

This guy protested for Black lives matter....and........and.....and I tell you..... Better treatment of veterans of our military.

He got driven out of the league for it.",2020-05-31 05:11:10
jvpewster,"&gt;practice squad

He started in 2016. I agree if he were a top 15 guy someone would have taken him, 49ers and him probably never part ways, but let’s not be ridiculous",2020-05-31 05:11:55
[deleted],[removed],2020-05-31 05:11:58
[deleted],[removed],2020-05-31 05:12:09
[deleted],[removed],2020-05-31 05:13:31
superchibisan2,"He was bad for business. Step dad cancelled his season tickets because of all of this. Not defending him, its truly was bad for business.",2020-05-31 05:13:33
-bbbbbbbbbb-,"Yes, lets take the word of a guy who was VP of league communications (not anything related to football or personnel) for less than two season and who earns his living carrying water for the Democrat party. This guy wasn't even part of the NFL when teams might have wanted Kaep.

This is the same NFL that signed Mike Vick and Donte Stallworth who both served jail time for killing dogs and people respectively. There's no such thing as bad for business, only people that are bad for football.",2020-05-31 05:14:16
Death_Co_CEO,"No one in any business wants people who rock the boat, let's say you go all in in him and then eventually he says something stupid just one thing suddenly you are now associated with that you dont want to be. I really feel for the guy, and he is going about everything in the right way. But no one wants to rock the boat, because if you do it may turn upside down",2020-05-31 05:16:24
[deleted],[removed],2020-05-31 05:18:08
[deleted],[removed],2020-05-31 05:18:57
Arcade80sbillsfan,"He never said anything stupid.  Agreed people like people falling in line

I was more commenting because this person said he wasn't good enough to be a backup QB.",2020-05-31 05:18:58
-bbbbbbbbbb-,The problem with this is the people supporting kaepernick won't be the ones coming out on top in a violent revolution.,2020-05-31 05:19:12
Secomav420,The logical follow-up is...Why?,2020-05-31 05:19:40
fstall303,"Let's talk about why he was drama? The fact is that instead of welcoming the protest and shedding light on police brutality on minorities Trump decided to weaponize it politically. Just so happens a big portion of football fans are also very conservative and fed into it which is why it was ""drama"". Calling him an SOB.",2020-05-31 05:20:35
a_bearded_man,Wasn't that the same rational for Tebow as well?  Not a bad player but way too much drama from his supporters and detractors so he was a liability?,2020-05-31 05:23:27
djsoundwave0,They saw Martin Luther King Junior is bad for business back in the day as well.,2020-05-31 05:23:30
C_Fall,I think you’re wrong in the sense that Kaep wasn’t a starting QB in the league but he certainly wasn’t a top 15 QB at the time. Mix that with the protesting and of course he didn’t get re-signed anywhere. I’m with Kaep and his movement. I believe he’s in the right. But don’t blame anyone but himself for being out of the league. He knew what he was doing. He knew he wasn’t going to have a long career in the NFL. He saw his shot and took it and he’s good at that. Glad he took his shot.,2020-05-31 05:23:45
_PukyLover_,"Oh boy, wait until next season finally starts!",2020-05-31 05:24:02
vanitas-element,"They won't be coming out on top by doing nothing either, at least one is cathartic.",2020-05-31 05:26:02
The740,"Drama bothers teams a great deal in general.  Tim Tebow never did anything wrong, and no team would ever sign him because he brings along a media circus and a very large, and frankly very obnoxious, group of people who are fans of his but don’t know the first thing about football.

Antonio Brown may be the best receiver in football, and he spent most of last year out of a job completely because he’s an annoying shitbird on his best day and drama follows him more than his own shadow does.",2020-05-31 05:28:02
FireFlinger,So are riots and burning cities.,2020-05-31 05:29:19
spygentlemen,Isnt it funny how both players got famous for taking a knee and lost their jobs for it.,2020-05-31 05:30:17
Fochinell,"&gt; Pointing out that the niners went 2-14 is disingenuous. 

Okay, I’ll blame the execrable Niners front office for their part but they weren’t the ones who somehow made Kaepernick run around in circles in the pocket for five seconds after the snap like Curly from the *Three Stooges* going “Whoop! Whoop! Whoop!” and ultimately finishing the play by either running for -3 yards, throwing with a wide open sidearm wobbly duck pass that would either wildly miss the intended receiver or bounce off the opposing team’s sideline Gatorade cooler, get picked off, perform illegal grounding, or get saaaaacked like the Packers did to him six times in one game.

What happened to Kaepernick is that he got figured out by the whole league.",2020-05-31 05:32:16
[deleted],[removed],2020-05-31 05:32:51
Chinsupolgirl,"Quarterback, presumably.",2020-05-31 05:34:01
jthom333,“Bad for business” = the American people have no problem with watching abusers being paid to play sports but an activist taking a knee triggers them lmao weak as piss,2020-05-31 05:34:09
mrquality,For NFL fans killing dogs is one thing but kneeling is an uppity step too far.,2020-05-31 05:34:10
calibared,Progressive change IS bad for business. How can people make money off of people if things change for the better?? /s,2020-05-31 05:35:16
Starfish_Hero,Nathan Peterman threw five interceptions in a half and still found himself a starting job by week one of the next season. The excuse never held water.,2020-05-31 05:35:24
hakuchioko,"No shit, no one wants that liability in their organization.  It's the NFL and they don't make money when CK is on the news.",2020-05-31 05:35:25
anon2777,that’s just not true. they will make more money going 10-6 or even 6-10 than 16-0 with a qb that half of the fanbase virulently hates,2020-05-31 05:40:16
MaekerBaefield,"Oh I’m absolutely with him in what he (and the rest of the league) was protesting. But you have to be able to separate your football evaluations and your beliefs from outside of football. They can’t blur each other. People refuse to hear football related criticism of him because of their other beliefs surrounding him. 

Almost the entire league was kneeling. More people would’ve been blackballed if it was purely for the kneeling. Not the case. And I used Eric Reid as an example because he was big in the kneeling and he’s been a starter his entire career. And OP saying he’s a huge NFL fan but had no idea who Reid is is a total lie.",2020-05-31 05:40:53
grebnesor1,The thing is that’s true there was literally a massive freak out by a lot of the right specifically about the kaepernick situation,2020-05-31 05:40:55
[deleted],[removed],2020-05-31 05:42:09
[deleted],[removed],2020-05-31 05:43:02
Temporal_Enigma,"People also forget how the Ravens were going to sign him, then his girlfriend called the owners ""Slavers"" and they backed out real quick. 

He also wouldn't take a backup job, demanded a starter salary and wouldn't take a 1 year deal. He was already being swapped for Blaine Gabbert before the kneeling and then after that season ended, he left in free agency and demanded a ton of money. Teams were ready to sign him, but didn't want to shell out on an expensive, backup caliber QB. 

The AAF and XFL both tried to sign him, but he demanded more than the league's were worth.",2020-05-31 05:45:40
fstall303,Tim tebow have the benefit of playing on a great defense but he was a terrible quarterback. He didn't even throw 48% for his career.,2020-05-31 05:47:51
SomeGuyOnThInternet,"Being a backup QB. Geno Smith is still able to get work as a backup FFS.

Kaepernick is a guy like Trubisky. Bottom tier starter, but top tier backup.",2020-05-31 05:49:09
aradsgfafdasdfasdf,You stated it was bad for business. It demonstrably wasn't.,2020-05-31 05:50:14
JessumB," Fans care about winning first and foremost.  People would quickly get over their issues if they wound up with a team winning a SB as a result of signing a QB, no matter how controversial.",2020-05-31 05:50:26
dukeofmadnessmotors,"&gt;the American people

Actually football fans, and unfortunately that's accurate. A lot of them don't care about abuse.",2020-05-31 05:53:12
Fochinell,"At some point we need stipulation from everyone that Kaepernick steadfastly refused to be anybody’s backup QB.  

His insistence about this and his refusal of genuine offers is not something that happened in an alternate universe’s timeline, but ours.  

This is precisely the meaning behind my question phrased “Doing what exactly?” thats being downvoted by his fans who maintain he was run out of football.",2020-05-31 05:58:07
[deleted],[removed],2020-05-31 05:58:49
TheBigBaby,"WhY cAnT THeY pRoTeSt pEaCefuLLy??

They tried that and we punished them for it!",2020-05-31 06:01:24
PotRoastPotato,"&gt;Probably before your time, 

I voted for Bob Dole in 1996, but thanks for the condescension.",2020-05-31 06:04:23
[deleted],[removed],2020-05-31 06:05:57
