body,author,negative,neutral,positive,compound
"thats just incorrect. the first reported case of CTE wasn't reported until 2005, by that time I was already playing college ball. I am glad I didn't have to join the military, it was either scholarship or military and I definitely wouldn't be where I'm at now had I enlisted, I would of never met my wife, probably wouldn't be sitting in this house etc etc",gospdrcr000,0.026,0.868,0.105,0.682
Why? Employers have that right.,KingBrinell,0.0,1.0,0.0,0.0
"That's not that good. And he won 1 freaking game as a starter. He had a decent stat line but never put his team in a position to win. The one offense he outplayed was the Rams, who were 32nd in scoring that season. How about you stop being dishonest with your argument?",midgetataurinal,0.247,0.645,0.108,-0.825
"You could find and replace Kaep with Flacco, only he won that super bowl with the better Harbaugh. Nick Foles was discarded as well.

Losing a Super Bowl 4 or 5 years prior doesnt put you on any pedestal.",SpicyMcHaggis14,0.093,0.598,0.308,0.91
"Except a lot of cities end up granting major tax breaks/endowments/building entire stadiums for sports teams that want to move in.  

You have no real say in your tax dollars being allocated in this manner.  So it's not as simple as not watching or not buying.  You're probably still supporting them in ways you aren't aware of.",heyman-,0.036,0.859,0.105,0.5106
"funny thing is I was wayyy better at hockey than football, my fam just couldn't afford the travel team expenses so I could get enough exposure to maybe get a hockey scholarship. high schools in florida dont have ice hockey teams unfortunately. I still have a really nice set of simmons pads, i need to strap them back up, its been forever.",gospdrcr000,0.035,0.837,0.128,0.7574
Man he really tried to save us from this...  he really did.  And the nation shit on him.,MoidSki,0.156,0.694,0.15,-0.0352
My brother had chronic knee issues from football. And the kicker for this is that he never even made it all the way through his freshman football camp. He got tackled from the side in the first week and tore his ACL. After the first surgery went badly he tore it again just walking after he was supposed to be healed and eventually ended up with 7 surgeries stemming from that one initial football injury.,kickd16,0.075,0.925,0.0,-0.7096
Read it again and maybe you’ll realize I never said that,Trappedintheshower,0.0,1.0,0.0,0.0
"For the record, you think a 90.6 QB rating, 16 TDs and 4 INTs is *bad*? 

It's a team sport, and he was on a horrible team. Team W-L is not an argument whether or not a QB is good enough to be in the NFL.",PotRoastPotato,0.13,0.778,0.093,-0.457
"They aren’t wrong.

As a QB, Colin Kaepernick was probably good enough to start for about a third of NFL teams when he left the 49ers. But the distractions and chaos that surrounded him both on and off the field made him simply not worth the risk.

The same was true for Tim Tebow, to a lesser extent in both areas.",jah05r,0.158,0.735,0.107,-0.5759
"it was either that or the military, so, I'm glad I didn't have to join the military",gospdrcr000,0.095,0.754,0.151,0.276
Your take is hilarious. You’re fucking funny dude.,starkgasms,0.0,0.504,0.496,0.7089
Big surprise there. There was an unspoken message going around to not hire him because he was bad for business. I dont think he expected to get cut from the team also. His record sucked. The team was 3-14 or something.  I'm not sure the score but the team's record was some where around it.,Sunshineal,0.124,0.85,0.026,-0.5763
"Football is an American sport. For Americans by Americans. That is the ONLY audience.

If you hate America then there’s no way you like football.

What did Colin expect, honestly?",BoBoMothBall,0.158,0.695,0.147,-0.1027
"Well yeah, didn't he make a bunch of pro-Castro comments when he was in Miami?  He knows how to fan the flames",Twist_RK,0.0,0.742,0.258,0.6808
I think you're correct,gospdrcr000,0.0,1.0,0.0,0.0
"I watched Frontline’s “League of Denial.”

My son will NEVER play football.",gotham77,0.156,0.844,0.0,-0.2584
"Unfortunately, I hear that quite a bit. I played hockey from age 4 through college (no scholarship). I was extremely lucky to have had a family able and committed to allowing me to play as much as I did. With the cost of equipment, travel, ice time, league fees it can add up extremely quickly. For a Florida resident, I would suggest inline roller hockey. Much easier to find a place to play than on traditional ice.",philosophy61jedi,0.027,0.799,0.173,0.8955
"This isn’t entirely true. There was a team that offered Kaepernick a contract the very next season and no one ever mentions it. 

The Denver Broncos offered Kap a contract worth (iirc) about $11 million a year just after he was cut. Kap thought he was worth $18 million a year. The Broncos were looking to sign Kap rather than pay Brock Osweiler. Kap decided to hold out for a better offer that never came. Keep in mind, even this short few years ago, QB salaries were very different. There was a “middle class” when it came to QB talent (there isn’t one now). Most Broncos fans like myself viewed Osweiller as a better option than Kaepernick at the time. 

Some say that the Broncos lowballed Kap, but the Broncos also lowballed Osweiller, apparently. Remember that Osweiller was coming off of a Super Bowl 50 season in which he had successfully backed up (and had outplayed) Peyton Manning.  Osweiller started about 4 games that year, I believe. The Broncos offered Osweiller $16 million, but he left and took $18 million from the Texans.",CO_74,0.047,0.837,0.117,0.9198
"Yea, and you can play beer league hockey for decades with minimal contact.",Chef_Sasquatch,0.0,0.833,0.167,0.34
"For the record, you think a 90.6 QB rating, 16 TDs and 4 INTs is *bad*? 

The other QB who started for the 49ers that year threw more INTs in 5 starts than Kaepernick threw in 11 starts. 

It's a team sport, and he was on a horrible team. Team W-L is not an argument whether or not a QB is good enough to be in the NFL.",PotRoastPotato,0.092,0.842,0.066,-0.457
"Did you read the article? This guy isnt breaking news at all, he's saying the league could have or should have rallied around Kaepernick instead of being reactionary.",SpicyMcHaggis14,0.0,1.0,0.0,0.0
"So, it turns out that old white men are  racists just like everyone said they were.

Good timing on this also.",BiggerBowls,0.13,0.669,0.201,0.2263
Sorry I thought you were replying to the thread not writing a non sequitur about cte when this thread is about NFL business tactics and Kap.,colgaddafi4prez,0.049,0.951,0.0,-0.0772
"I played both, started in roller moving to ice",gospdrcr000,0.0,0.769,0.231,0.34
All athletes should boycott returning to their teams. And we should boycott events and PPV.,I-suck-at-golf,0.261,0.739,0.0,-0.5574
"I never said it was unlawful, I just pointed out a fact. Go misdirect your bs at someone else.",TophShit,0.0,1.0,0.0,0.0
"Interesting. I started ice and moved to roller. This was after I learned of 3 herniated discs in my lower back. I never said hockey was risk free, but a bad back beats the shit out of brain damage.",philosophy61jedi,0.227,0.596,0.177,-0.4019
"QB rating is not the be-all-end-all... But mostly because it makes mobile QBs who run well like Kaepernick look WORSE than they are.

His QBR (which is a much better measure of passer value) 

ESPN's proprietary QBR better than QB rating? Literally the first time I've heard anyone outside of ESPN who believes this. I'm actually kind of blown away, I have a hard time believing your opinion is based in anything other than it furthers your narrative. 

All you need to know QBR is suspect is that a huge part of its calculation is a ""clutch"" factor. ""Clutch"" is a thoroughly debunked concept in sports by legitimate statisticians.

QBR makes decent QBs on bad teams (like 2016 Kaepernick) look worse, and mediocre QBs on good teams look better than they are.",PotRoastPotato,0.111,0.706,0.183,0.9011
"Thats about 17 quid here, i would want to see the King of the Hot Dogs for that kind of money.",syuk,0.0,0.939,0.061,0.0772
"And that was never my main talking point? 

It’s alright to be wrong, no one is mad at you",PM_ME_YOUR_UNIDAN_,0.333,0.588,0.078,-0.7579
"No, he wasn’t blackballed out of the league. Kaep was offered a contract with the Broncos the very next year.  
He turned it down because he though he was worth more than $11 million. Brock Osweiller also turned the Broncos same contract offer down so they ended up having to go with Trevor Siemien the year after their Super Bowl victory. 

Keep in mind that Kaep wanted $20 million, which would have made him the fifth highest paid QB in the league at that time. The Broncos offer of $11 million would have made him about the 20th highest paid - which would have been about right. Kaep just though he was worth more. Once he sat out a year, his value diminished.  Just like Antonio Brown’s value will diminish after sitting out last year. 

Athletes don’t age like wine. They age like bread.",CO_74,0.0,0.872,0.128,0.9517
"And that’s exactly what’s wrong with this country in a nutshell. Business and greed always trump the well-being, safety, and civil rights of the people. How much longer can this government push its capitalist propaganda before people wake up and realize they don’t give a fuck about us?",BonsaiBudsFarms,0.198,0.753,0.049,-0.8176
Sorry I couldn't stand you saying something that wasn't true,gospdrcr000,0.312,0.688,0.0,-0.3883
"If they start caring about black lives, they’d have to look in the mirror and confront their CTE issues",Rizzpooch,0.078,0.776,0.146,0.3612
"The whole point of protests is to change the system, not to oblige by it. Just because something is illegal, doesn't mean it's wrong. 

Women protested for the right to vote, black people protested for the right to be seen as human beings, gay people protested for the right to get married. All of these things were illegal. Should they have said, 'Well the law says it illegal for me to do these things, so clearly I'm in the wrong here. Ah well!'.",TheOtherCumKing,0.202,0.697,0.101,-0.8536
Yup just downvote this guy because you can’t handle the truth.,aznkupo,0.0,0.813,0.187,0.3182
If he was good he would have found a team. The crazy drop off in his production (and crazy salary demands) are why he doesn’t have a job. Not to mention his girlfriend labeling potential employers racists while in negotiations. Who would hire someone like this to their organization? He never should have backed out of the final year w SF.,jbleek,0.162,0.762,0.076,-0.6217
"That's a bold faced lie, and you know it.",qwertx0815,0.0,0.755,0.245,0.3818
"I said it's not that good. Good job changing my words, you're already starting off with lies lol. And he hardly threw picks because he held on to the ball getting sacked on nearly 10% of his drop backs. He never took chances, hence no picks but no wins either. Sam Bradford had that same ratio and won 7 games that season. So it must be racist owners as to why he's not starting anymore right?",midgetataurinal,0.22,0.704,0.075,-0.8555
"Had to do a double take on your comment. ""wait, you can quit 8th grade?""",Airlockoveruse,0.0,1.0,0.0,0.0
I stopped watching a few years ago. Fuck the NFL. It's been mismanaged for a while now,Itsnotreallynotme,0.265,0.735,0.0,-0.6597
How’s that working out?,kaestiel,0.0,1.0,0.0,0.0
[https://www.usatoday.com/story/news/politics/2018/09/09/donald-trumps-toughest-tweets-kneeling-during-national-anthem/1248196002/](https://www.usatoday.com/story/news/politics/2018/09/09/donald-trumps-toughest-tweets-kneeling-during-national-anthem/1248196002/),GoldenMegaStaff,0.0,1.0,0.0,0.0
"Nah its cause he wasnt good enough for him to be worth the drama. Dude got benched for Blaine Gabbert, one of the worst QBs of this century. No doubt he wouldve been signed if he was still playing like he was in 2012, but at that point he was a shell of his former self.

Plus, Baltimore tried to sign him, but his gf called the Ravens owner a slave owner and their legendary middle linebacker a slave on social media. There are more factors here than just the kneeling.",gi_joe_kung_fu_grip,0.057,0.879,0.064,-0.0767
Its the first admital from an nfl person that his kneeling affected his job status.  There are many people in this very thread still refusing that fact.,Dazegobye,0.154,0.846,0.0,-0.552
"Doubtful it’s the same guy but a pretty similar story written in a fantastic long form article. It’s kinda tough to read all the same. 

https://features.texasmonthly.com/editorial/still-life/",necronomicana,0.088,0.643,0.269,0.8477
I was addressing the gabbert bullshit that keeps getting thrown around as a defense,Dazegobye,0.22,0.694,0.087,-0.5106
Why is this a surprise?  It's an entertainment industry.,fannyj,0.0,0.588,0.412,0.5994
"Someone I went to high school with was forced to stop playing football because he had too many concussions (the school forced him to stop). I can’t imagine the shit he deals with today, and we only graduated 6 years ago.",KarateKid917,0.203,0.684,0.113,-0.5574
...pretty bad example here as Ali gave up more than his job for it. Went to jail. Kaepernick wont even take a back up job.,SpicyMcHaggis14,0.118,0.774,0.108,-0.0772
So no then? Did not read the article?,SpicyMcHaggis14,0.29,0.71,0.0,-0.4316
If being controversial is bad for business then why isn't Trump homeless?,Invalid_Pleb,0.346,0.654,0.0,-0.6486
Funny how people hated a player peacefully protesting to shed light on police brutality and now years later wonder why those peaceful protests have exploded into violence.,drwsgreatest,0.374,0.418,0.209,-0.8176
Are you serious? Of course no company in its right mind is going to keep on an employee whose own significant other is literally calling the company they work for SLAVERS. That’s just bad PR and can ruin a company.,Regular-Adventure,0.227,0.735,0.038,-0.8402
What a bunch of malarkey. patriots had no problems hiring Aaron Hernandez.,mceatalot,0.0,0.83,0.17,0.3089
"This is flat out not true, clearly you’ve never seen the Jets play.",zlide,0.27,0.589,0.141,-0.2937
It depends on what business you are in.,icenirevolt,0.0,1.0,0.0,0.0
"&gt;But... that’s the definition of free speech. That the government, specifically, will not infringe upon it.

The government literally threatened the NFL with ""consequences"" if they don't blacklist him...",qwertx0815,0.09,0.811,0.099,0.0772
"&gt; In fact, I bet if one team had chosen Kaepernick, they would have gotten a torrent of ... media attention because of it.

Yeah, that's exactly the problem. The teams want their attention focused on the gridiron, not off it. It's also why Tebow is no longer in the league.",PAJW,0.086,0.807,0.107,0.0516
NFL Executive = capitalist pig... It is known.,JFrey0,0.0,1.0,0.0,0.0
All these comments are people who don’t know dick about football making asinine rationalizations for a blatantly racist collective decision.,zlide,0.289,0.711,0.0,-0.8074
"You do know that the majority of NFL fans also are the people who attend Trump rally’s right. 

He was bad for business.",ThePrestigeVIII,0.137,0.863,0.0,-0.5423
Lol at bad for business.  Donte stallworth and Leonard little killed people and still played.,gumercindo1959,0.322,0.46,0.218,-0.5434
Fuck the NFL. They are dirty af,RTwhyNot,0.561,0.439,0.0,-0.7506
"And I don't like that employers have more rights than people. 

It's one thing to discard an employee for hate speech, but that should be the extent of their right in limiting one's freedom of speech unless the person is DIRECTLY representing the company.

I get that this isn't a popular opinion.",Lunamrath,0.137,0.768,0.095,0.102
"When your business is racist idiots, informed compassion is a competitor.",mcandre,0.25,0.562,0.188,-0.25
Michael Vick ran a dog fighting league and the Eagles picked him up just two years after the court case.,RedHairedRedemption,0.116,0.884,0.0,-0.3612
"employing domestic abusers is bad PR and can ruin a company, but the NFL still does it. 

and yes once again someone else’s thoughts and words shouldn’t have an affect on his employment. his views are separate from hers.",easynektar,0.153,0.769,0.078,-0.34
"I mean ethics aside. It IS good for buisness. They're not wrong. 

The fan base of the NFL is middle aged white uneducated Americans.   You just have to be morally bankrupt to support that position though.",Canadian-shill-bot,0.124,0.693,0.182,0.3802
Dude are you high? The posted article is about Kap and his effect on the league with his protest. You are chiming in to humble brag to internet strangers you played ball in college and then connect it to something about cte which has nothing to do with posted article.,colgaddafi4prez,0.038,0.916,0.046,0.1027
"It’s a shame the NFL didn’t think using its massive nationwide platform to help generate movement in a positive direction towards a safer country for people of color. Seeing as a good portion of its viewing audience and most of its active participants are indeed people of color. 

Instead it was bad for business and now we are rioting in the streets instead. Good call on that one NFL. I kinda hope your stadiums are the next thing protesters target, maybe you’ll get the point then but I wouldn’t bet on it.",Dmav210,0.057,0.808,0.135,0.7171
Kaepernick also broke records as a rushing QB.,caught_in_a_beartrap,0.286,0.714,0.0,-0.4215
Thats kinda the point - athletes have always stood up for what they believe is right. Kaep did the same and was vilified for it,jpell14,0.0,1.0,0.0,0.0
Playing pro ball is NOT a right.,HHVN,0.0,0.769,0.231,0.2023
1.50 hotdogs in Atlanta,patrickclegane,0.0,1.0,0.0,0.0
Turns on the NHL.  You sure about that?,Stockboy78,0.0,0.753,0.247,0.3182
He was sure as hell better than every QB Houston has started from ‘13 until Deshaun Watson. Team was drowning in QB Hell.,Mezzanot,0.275,0.569,0.156,-0.7184
So its fine for a company to fire you for wearing a Maga hat? Or a bernie t-shirt?,rusthighlander,0.132,0.768,0.1,-0.1733
And he wasn't released he quit,oldengine,0.0,1.0,0.0,0.0
"I can tell a lot about you by this reply and it has nothing to do with football. 

Try and educate yourself and be a better person.",el_dude_brother2,0.0,0.9,0.1,0.4404
Someone wearing a Jersey and protesting on company time(during the anthem) is somehow not directly representing the company?,HHVN,0.141,0.859,0.0,-0.4215
"I mean he was objectively bad for business. From a purely business perspective, there's no denying that",Delicious_Preference,0.17,0.73,0.099,-0.3536
"I've slowly stopped watching sports in general these past few years, but the NFL is completely off my radar these days for multiple reasons. The way they treated Colin Kaepernick is high on the list. The way they covered up the effects of CTE for years, and even now refuse to pay players from the 70s and 80s with health problems directly related to the sport. It just doesn't appeal to me anymore, and I don't miss it at all.",kazejin05,0.109,0.871,0.019,-0.774
"No duh.

The Jets expressed interest and their switchboard lit up with fans threatening to cancel their season tickets.

If he were any good they would sign him and the fans would chill once he won a few games. But a career average of 177 yards a game and losing your starting job to Blaine Gabbert? Then you're not worth the backlash.",LandmassWave,0.151,0.761,0.089,-0.5266
$20 hotdogs are great for business if people are willing to pay it.,LandmassWave,0.085,0.667,0.248,0.5719
"I like how your example has the NBA refusing to take the opposing side, the side where cops don’t murder innocent people SHOULD be good for business and you just helped make it abundantly clear that NFL fans are mostly a racists cancer that the league bows down to. 

Stop supporting a league that doesn’t value human life over $$$",Dmav210,0.213,0.596,0.191,-0.5859
"That's what I don't like about these people, they won't stand up for what's right. They WANT TO BE PEOPLE PLEASERS.",wishlist19,0.085,0.724,0.192,0.3931
"This is such bullshit. He went to 3 straight nfc championship games, you don't do that with a backup QB.",SmilinGoat,0.265,0.565,0.17,-0.5719
"That’s false. But keep assuming, racist.",MaekerBaefield,0.524,0.476,0.0,-0.7579
"Exactly. He wasn't really the same QB that took the 9ers to the Super Bowl in 2012. His game fell off dramatically.

Its like, if Aaron Rodgers protested, you think the Packers would cut him? You think the league would ""blacklist"" him? Of course not.

The game has to match all the baggage that comes with it. It didn't for Kaep.",fobmanx,0.053,0.846,0.1,0.6322
"In the NFL where it's majority fanbase knows the names of every player and views them as individuals? No.

By directly I mean being a spokesperson or running a social media account. Along those lines.",Lunamrath,0.0,1.0,0.0,0.0
"This is a perfect example of ""sometimes the best thing to say is nothing""",raver6,0.0,0.603,0.397,0.836
And he pulled that stunt with the workout. 16 teams said screw it and didn't go to the new location.,LandmassWave,0.069,0.931,0.0,-0.1027
"I'm high as a motherfucking kite, if the NFL see's kap as 'bad for business' because he has the balls to protest some shit he cares about I see the NFL as bad business. Which is what I came here to talk about. also, fuck you.",gospdrcr000,0.321,0.63,0.048,-0.9509
yeah it's pretty simple. He was a controversial figure whose controversy far outweighed any benefit. If he was as skilled as Tom Brady he'd still have a job.,cameraman502,0.053,0.702,0.246,0.765
"All about the Benjamin’s. Fuck equality, there’s money to be made to these fucks.",pooponagoose,0.355,0.645,0.0,-0.765
Yea that part of it came off as arrogance to me. I don’t think anybody would give him even backup money. Would you really want your backup QB distracting from the team. Every starter in the league would shut that down.,appstategrier,0.124,0.841,0.035,-0.6133
"Trump TOLD THEM that he had every intention of continuing to use the issue to fire up his bigoted supporters and tear his country apart. 


“This is a very winning, strong issue for me,” he told Jerry Jones, owner of the Dallas Cowboys. “Tell everybody, you can’t win this one. This one lifts me.”",gotham77,0.037,0.75,0.214,0.9113
"Well it's a team sport. Unless he was a proven all star or goat, showing him special treatment is to the detriment of team morale.",kookedout,0.0,0.827,0.173,0.5859
It wasn’t even that wild on an opinion to have and it’s not right to force anyone to stand for the National anthem.,Corazon-DeLeon,0.0,1.0,0.0,0.0
"Ohhh please.  He's free to protest on his time, not on the clock.  

His job is to sell Nikes and Fords and Miller.  No one wants to see his bullshit, except for other self-loathing malcontents.

And yes, I will be voting.",EnticeAddleEnslave,0.156,0.682,0.162,0.0772
"So which is it, no one wanted Kaepernick as a backup because he wasn't worth the media circus, or was it that a bunch of teams were offering Kaepernick backup positions but Kaepernick turns it down? I can't keep track.",PotRoastPotato,0.072,0.928,0.0,-0.2342
"I am. I have played and watched both. I’ve found this analogy works pretty well: football is a demolition derby where hockey is a stock car race. Every single play in football is violent where hockey is much more about finesse. 

Here’s a serious question: how can they be at the same level of violent contact when football plays 1 game per week that consists of 15-20 minutes of live play per game where hockey plays multiple games a week with 60 minutes of live play? It’s not even close. Football is **much** more violent than hockey.",philosophy61jedi,0.113,0.725,0.161,0.3832
"Kap was legit when he came out of no where as a backup and there was no film on him. But he was sort of a one trick pony. Once film came out and professional coaches dissected the fuck out of his game, it was night night for his career.",RIDEMYBONE,0.167,0.833,0.0,-0.8047
"Yes and all we have to do in order to believe this is ignore the fact that half the teams in the league don’t have a decent quarterback. 

It’s a joke that guys like Blake Bortles remained starters while Kaepernick couldn’t even get a phone call. And it insults the intelligence of reasonable people to suggest it was any other reason except bigotry and cowardice.",gotham77,0.071,0.789,0.14,0.6369
"I care very much for Colin's cause, but it I talked about any politics at work I'd be fired. That is the way with most jobs. My company may agree or disagree with me, it's just not the place for it.",BearsPlayingTwister,0.164,0.731,0.106,-0.6059
Yes I’m sure I speak for all of us when I say we’re extremely impressed with your concern for gays.,gotham77,0.0,0.669,0.331,0.8122
That “workout” perpetrated by the NFL was an absolute farce and you know it. Who do you think you’re fooling with this racist garbage?,gotham77,0.309,0.691,0.0,-0.8555
"They get free rides and a chance to earn a degree, even though most of them eventually drop out.  There are lots of academic scholarships available (especially for minorities) but being an athlete is much more admired by younger people than being a studious bookworm.  It's unfortunate that most of these ""scholar athletes"" are unable to leave their pasts behind them, even ones who make it to the big leagues (i.e., Aaron Hernandez).",cedarapple,0.083,0.813,0.104,0.3998
